{
  "version": 1,
  "range": {
    "fromYear": -4,
    "toYear": 101,
    "defaultYear": 50
  },
  "stops": [
    {
      "id": "4bc",
      "year": -4,
      "title": "Fixture start",
      "summary": "Fixture start state.",
      "sources": [
        "bib:pleiades-place-resource"
      ]
    },
    {
      "id": "ad44",
      "year": 44,
      "title": "Fixture change",
      "summary": "Fixture state change.",
      "sources": [
        "bib:pleiades-place-resource"
      ]
    }
  ],
  "entities": [
    {
      "id": "province-judaea",
      "name": "Roman province of Judaea",
      "kind": "roman-province",
      "romanSide": true,
      "sources": [
        "bib:pleiades-place-resource"
      ]
    },
    {
      "id": "client-antipas",
      "name": "Tetrarchy of Herod Antipas",
      "kind": "client-tetrarchy",
      "romanSide": true,
      "sources": [
        "bib:pleiades-place-resource"
      ]
    },
    {
      "id": "outside-parthia",
      "name": "Parthian Empire",
      "kind": "outside-empire",
      "romanSide": false,
      "sources": [
        "bib:pleiades-place-resource"
      ]
    },
    {
      "id": "uncertain-roman-side",
      "name": "Roman-side control uncertain",
      "kind": "uncertain",
      "romanSide": true,
      "sources": [
        "bib:pleiades-place-resource"
      ]
    }
  ],
  "areas": [
    {
      "id": "galilee",
      "locationId": "galilee",
      "focus": true,
      "periods": [
        {
          "fromYear": -4,
          "toYear": 44,
          "holderId": "client-antipas",
          "ruler": "Herod Antipas",
          "sources": [
            "bib:pleiades-place-resource"
          ]
        },
        {
          "fromYear": 44,
          "toYear": 101,
          "holderId": "province-judaea",
          "sources": [
            "bib:pleiades-place-resource"
          ]
        }
      ]
    },
    {
      "id": "perea",
      "focus": true,
      "periods": [
        {
          "fromYear": -4,
          "toYear": 44,
          "holderId": "client-antipas",
          "sources": [
            "bib:pleiades-place-resource"
          ]
        },
        {
          "fromYear": 44,
          "toYear": 101,
          "holderId": "uncertain-roman-side",
          "note": "Status in the sources is unclear for this interval (fixture).",
          "sources": [
            "bib:pleiades-place-resource"
          ]
        }
      ]
    },
    {
      "id": "judaea-heartland",
      "focus": true,
      "periods": [
        {
          "fromYear": -4,
          "toYear": 101,
          "holderId": "province-judaea",
          "sources": [
            "bib:pleiades-place-resource"
          ]
        }
      ]
    },
    {
      "id": "parthia-west",
      "focus": true,
      "periods": [
        {
          "fromYear": -4,
          "toYear": 101,
          "holderId": "outside-parthia",
          "sources": [
            "bib:pleiades-place-resource"
          ]
        }
      ]
    }
  ]
}
